ССЫЛКА НА ЗАПИСЬ;ССЫЛКА НА ЗАПИСЬ С УЧЁТОМ ВЛАДЕЛЬЦА;ВЛАДЕЛЕЦ СТЕНЫ;АВТОР ЗАПИСИ;ДАТА И ВРЕМЯ;ТЕКСТ ПОСТА;ЛАЙКОВ;РЕПОСТОВ;КОММЕНТАРИЕВ;ПРОСМОТРОВ;ССЫЛКА НА КОММЕНТАРИЙ;НАЗВАНИЕ АВТОРА;ПОДПИСЧИКОВhttps://vk.com/wall-217162070_28898;https://vk.com/club217162070?w=wall-217162070_28898;https://vk.com/club217162070;https://vk.com/club217162070;2024-02-13 08:20;Сода в помощь огороднику    1. Сода от мучнистой росы  Почти каждому дачнику знакома такая напасть, как мучнистая роса. Справиться с ней вполне под силу пищевой соде. Вот два проверенных рецепта:  Разведите в 1 литре воды 1 ст. л. соды, добавьте 1 ст.л. растительного масла и 1 ст. жидкости для мытья посуды. Смесь залейте в распылитель, хорошенько взболтайте. Опрыскивайте ей растения раз в неделю в облачную, но сухую погоду.  В 5 литрах воды разведите 2 ст. л. соды и 20 грамм мыла. Этим раствором растения опрыскивайте в первый раз перед цветением, а затем ещё 3-4 раза с интервалом в неделю.    2. Сода для омоложения розовых кустов  Чтобы омолодить кусты роз размешайте в 5 литрах воды: 1 ч.л. соды, 1/2 ч.л. нашатырного спирта и 1 ч.л. соли Эпсома.    3. Сода против сорняков  Избавит сода и от мелкой сорной травки, пробивающейся между плитками дорожки или площадки для отдыха (как сейчас модно говорить — патио). Для этого пролейте щели между плитками крепким содовым раствором.    4. Сода для защиты капусты  Чтобы избавиться от гусениц, поедающих молодые капустные листочки, смешайте в равных частях соду, муку. Такой прикорм вредителю очень понравится, но к счастью садовода, окажется для них несовместимым с жизнью.    5. Сода для подкормки томатов  Удивительно, но многие бывалые дачники утверждают, что содовые подкормки (опрыскивание) делают помидоры слаще.    6. Определение и изменение кислотности почвы  Сода — самая известная бытовая щелочь. Поэтому при смешивании с наиболее кислой влажной почвой (рН до 5) поведет себя также, как при гашении уксусом в быту, т. е. зашипит и запузырится.    Можно использовать соду и для уменьшения кислотности почвы, главное в этом деле не переусердствовать, т. к. на некоторые растения сода влияет не лучшим образом.    7. Сода для винограда  Пищевая сода применяется на виноградниках в период созревания ягод, это увеличивает их сахаристость и уменьшает повреждаемость серой гнилью. Опрыскивают всю надземную часть раствором – 75 гр. соды на 10 литров воды. На фруктовых деревьях такое опрыскивание применяется против листогрызущих гусениц.    8. Моющее средство  После дел садово-огородных руки выглядят не лучшим образом. Но и здесь сода приходит нам на помощь. Она поможет эффективно очистить руки от въевшейся садовой грязи.  Хорошо содой мыть грязную посуду.    9. Отдушка для компостной кучи  Если ваша компостная куча стала источать неприятный запах, используйте соду, чтобы исправить это! Просто добавьте соду в компостную кучу и, через некоторое время, вонь должна исчезнуть.;7;5;0;1028;;Дача в радость;137021https://vk.com/wall353806304_22830;https://vk.com/id353806304?w=wall353806304_22830;https://vk.com/id353806304;https://vk.com/id353806304;2024-02-13 06:22;Помни и отмечай свои праздники.а не стелись перед басурманскими фанатиками! Негоже басурманские недопраздники отмечать День влюблённых по-русски 8 июля.День семьи,любви и верности! Странные дела творятся в мире, прогресс крепчает. Веками жили люди, любили друг друга, причем любили гораздо крепче, чем сейчас. И не знали никакого «дня святого валентина» в качестве дня влюбленных. А сейчас любить разучились, из созданных семей сохраняется лишь 10%, зато массово научились праздновать «валентинов день». Ах, какой он милый на картинках, этот «день влюбленных» - «день святого валентина», он весь такой плюшево-цветочный, сердечково-шоколадный! Просто спальня маленькой девочки, а не праздник…  За невинным внешне праздником скрывается пропаганда гомосексуализма, разврата и избиение женщин. Поэтому стоит подробнее взглянуть на историю происхождения этого сомнительного торжества.  Что же это за чудо-праздник такой, валентинов день, кто его придумал и зачем?  ПРОИСХОЖДЕНИЕ И ЛЕГЕНДЫ  День святого Валентина - назван по имени раннехристианского мученика. св. валентин жил в итальянском городе Терни в III веке и был казнен 14 февраля 270 г. Считается, что он был канонизирован папой Римским Геласием I в 494 г. Этот праздник назван в честь как минимум двух раннехристианских мучеников с именем Валентин. «День святого валентина» берет свое начало с легендарных Луперкалий – фестивалей эротизма, отмечавшихся 14 февраля. О размахе оргий, насилия над женщинами, поощрения гомосексуализма, непременно сопровождавших празднование, можно подробнее узнать в специальной литературе или почерпнуть из других открытых источников.  Кто же был тот человек с именем, которого связывают традицию празднования «дня всех влюбленных»? В многочисленных публикациях появляющихся в канун 14 февраля вы можете прочитать следующую красивую легенду.  «Христианская религия была вне закона, когда священник Валентин проповедовал в Риме в III-м веке. Во времена императора Клавдия II (268-270) началась война с готами и был объявлен набор молодых людей в армию. Но те, кто был женат, не хотел бросать своих жен, а те, кто был влюблен, - своих любимых. В гневе Клавдий запретил брачные обряды, но Валентин не подчинился приказу и продолжал венчать молодых людей. Это сделало Валентина другом всех влюбленных в Риме, но привело в ярость императора. Валентин был схвачен, заключен в тюрьму и казнен 14 февраля 269 года. Накануне казни он послал письмо дочери начальника тюрьмы, которая была его возлюбленной. В письме Валентин прощался с нею, благодарил за все и подписался: 'Твой Валентин'. Это и положило основание традиции Дня святого валентина». На первый взгляд все кажется очень правдоподобно и исторически выверено. Но на самом деле совершенно несостоятельно. Во-первых, потому что таинство венчания сформировалось в Церкви только в эпоху средневековья, в III веке такого обряда просто не было. Значит, Валентин никого не венчал. Во-вторых, не надо быть большим знатоком церковного права, что бы понимать, что священник не может вступать в брак. Такое установление мы находим еще в Новом Завете. Священник, если он не женился до своего рукоположения в сан, теряет каноническую способность на брак. В противном случае он совершает большой грех, за который наказывается лишением сана. Таким образом, у Валентина, если бы он был священником, появление новой возлюбленной означало бы факт измены или своей супруге или своей вере. При подобных обстоятельствах такой человек просто не мог быть прославлен в лике святых. Приходиться признать, что эта красивая легенда просто неграмотная ВЫДУМКА христианской Церкви.  Другую версию о происхождении этого торжества предложил священник Греческой православной Церкви Георгиос Металлинос. Согласно его мнению, традиция празднования этого дня была установлена американским актером Рудольфом Валентино, умершим в 1926 году. Последний считал себя идеалом всех любовников и в этот день устраивал в своем доме развратные вечеринки, которые называл «Valentine’s Day».  В любом случае говорить о древних традициях празднования этой даты не приходиться. Да, Церковь знает несколько древних святых с именем Валентин, среди них и пресвитер, и епископ пострадавшие в III веке. Имеются их старинные жития, в которых, разумеется, нет ничего из того, что предлагают современные «летописцы». Очевидно, что первоначально возникла идея и коммерческая предпосылка празднования «Дня всех влюбленных», а уже после стали подводить под нее историческую составляющую. Таким образом, у февральского праздника в Риме древние корни. В любых его вариантах рядом шли любовь и страх, смерть и боль. То же самое можно сказать и о средневековом и современном его толковании. И люди такое празднуют?!?!  МАТЕРИАЛЬНАЯ ЗАИНТЕРЕСОВАННОСТЬ, КУЛЬТ КОМЕРЦИИ (кому выгодна популяризация празднования дня святого валентина)  Когда же она появилась, и стал праздноваться новый день календаря? На самом деле, совсем недавно. Это родное дитё эпохи капитала. Свое победное шествие праздник начал, разумеется, из Америки в XIX веке. И во многом обязан своим успехом коммерческой составляющей: продаже подарков и почтовых открыток-сердечек, активно продвигаемых двигателем торговли – рекламой.  Стоит только удивляться, как современный «русский» человек способен доверчиво, без анализа и рассуждений принимать все культурные отбросы, которые ему предлагают СМИ и проявления западной или американской культуры потребления. Скажут – «Ваня, сегодня у нас «Хеллоуин», и Ваня покорно справляет праздник, когда по кельтским представлениям на землю выходит всякая нечисть. Или: «Ваня, сегодня всемирный день святого валентина!» – и наш «Ваня» ударяется во все тяжкие… Что тут скажешь, – в Европе прорвало культурную канализацию, а у нас все всплывает… В соответствии с планом Алена Даллеса: «Мы будем браться за людей с детских, с юношеских лет, главную ставку будем делать на молодежь. Станем разлагать, развращать, растлевать ее… Мы незаметно подменим их ценности на фальшивые и заставим их в эти фальшивые ценности верить…» по молодежи тяжелым катком прошелся секспросвет, щедро спонсируемый разными «соросами». На этом очень неплохо заработали те, кто выпускает молодежные журналы, аптечные изделия и пр. И если мы начнем вспоминать, когда стал прививаться на нашу почву неведомый нам прежде «день влюбленных», то увидим, что он начал вползать к нам через СМИ сразу после первой отбитой нами атаки полового просвещения наших детей.  Различные шоколадки, печенюшки, конфетки, сердечки, купидончики (амуры), виртуальные открытки в соцсетях, бумажно-картонные и прочие «спецсредства» для втягивания молодых в празднование «валентинова дня» – по сути то же самое, что и наживка с прикормом, для снастей при ловле рыбы.  ПРЕДПОСЫЛКИ ВОСПРИЯТИЯ И ПРИНЯТИЯ Дня Святого Валентина. ДУХОВНАЯ И ПСИХОЛОГИЧЕСКАЯ СУТЬ  Более ста лет назад, пройдя «американизацию», праздник постепенно приобрел свой современный вид.  Валентинов день вихрем ворвался в нашу жизнь в середине 90-х годов XX-го века. И многие наши земляки, порядком подуставшие от бесконечных потрясений и элементарного недостатка положительных эмоций, на ура восприняли новый праздник, как тогда казалось – праздник любви.Но таковы особенности современной масс-культуры, когда постепенно выхолащивается смысл праздника, как растаявшая во рту конфета, а в красивую обертку заворачивается все что угодно, но только не традиционные человеческие ценности, на которых зиждилась жизнь многих поколений наших предков.  Почему пока малоэффективны разъяснения о подоплеке всех этих «дней влюбленных»? Потому что очень трудно и часто невозможно рационально бороться с тем, что находится в сфере эмоционального.  Почему молодые не хотят слышать о том, что на самом деле спрятано за этими «днями»? Скорее всего, потому, что их притягивает слово «любовь» в нашем жестком мире, в котором «оскудевает любовь». Рано оторванные от родителей и прошедшие через систему «ясли-детский сад», не обласканные родительской любовью, не защищенные ею, но отрастившие шипы и колючки, они как воздух ищут любовь всю оставшуюся жизнь и попадают на вот такие самые подмены. Для них любовь – это уже теперь не тепло, уют, много совместных домашних дел и разговоров. Родители, отдающие все свое время и силы зарабатыванию денег, с детьми выстраивают чисто функциональные отношения: накормить, одеть, обуть, обеспечить развлечение. Душевно и духовно не развитые дети тоже не могут никому отдать того, что сами не получили. Намного проще купить бумажное или шоколадное сердечко, кому-нибудь подарить и забыть об этом. Теперь уже это называется любовью.Любовь-взгляд, любовь-тайна, любовь-состояние – исчезают. Появляются действия любви. Любовь становится функцией. Это раньше были переживания. Сейчас все перемещается в предметную деятельность. Тонкость душевных переживаний пропадает.  К счастью, не все попадают в придуманные беспринципными коммерсантами «дни-ловушки». Не все ведутся на эти «липовые праздники». Если поначалу молодежь бросилась во все тяжкие, то здоровая часть общества, в основной своей массе, к этим «дням» все-таки относится трезво и спокойно. Естественно – такие люди сердцем чувствуют искусственность, суррогатность таких псевдопраздников как «Валентинов День».  Восстановление крепких семей в нашем обществе также демонстрирует нам, что подлинная семейная любовь безмерно выше тех лукавых «дней». Подлинные духовно-нравственные ценности возвращаются в нашу жизнь.  А «день святого валентина» является аморальным праздником, направленным на превращение интимных чувств во всеобщее и публичное действо, а также эксплуатирует низменные чувства и извращает само понятие любви.;2;1;0;143;;Калужский Копатель;9709